input,output,similarity_score,not_logical,is_correct,reasoning,suggested_diagnosis
hi doctor i think i might have turner syndrome,okay in that case you will need to undergo a complete physical skin exam an ultrasonography and some other diagnostic procedures such as an interview evaluation and consultation additionally well need to perform an echocardiography examine your breast and check your eyes and ears for any issues well also do a depression screening to assess your mental health,0.2991624176502228,False,True,"The patient explicitly states a suspicion of Turner Syndrome. The doctor's response outlines a comprehensive and appropriate set of diagnostic procedures specifically designed to investigate and confirm or rule out Turner Syndrome, including a physical skin exam, ultrasonography, echocardiography, breast exam, eye/ear checks, and depression screening. While the patient did not list specific clinical symptoms, their direct mention of 'Turner syndrome' directly necessitates the outlined diagnostic investigation, making the doctor's plan highly suggested by the patient's input.",okay in that case you will need to undergo a complete physical skin exam an ultrasonography and some other diagnostic procedures such as an interview evaluation and consultation additionally well need to perform an echocardiography examine your breast and check your eyes and ears for any issues well also do a depression screening to assess your mental health
doctor i am experiencing some problems during my pregnancy lately,i see in order to diagnose any possible complications we need to run a series of medical tests the first test we need to do is a urinalysispatient okay what other medical tests do i need,0.2480663061141967,False,True,"The patient's symptoms are very general ('problems during my pregnancy lately'). In response to such a broad complaint, a doctor's immediate step is to initiate a diagnostic workup to identify potential complications. A urinalysis is a fundamental and common screening test during pregnancy, used to detect a wide range of issues including urinary tract infections, pre-eclampsia, gestational diabetes, and kidney problems. Suggesting a urinalysis as the first test to investigate 'any possible complications' is a highly appropriate and medically sound initial step in the diagnostic process. The doctor is not making a specific disease diagnosis at this stage but is outlining a necessary and correct plan for investigation.",i see in order to diagnose any possible complications we need to run a series of medical tests the first test we need to do is a urinalysispatient okay what other medical tests do i need
doctor i was diagnosed with congenital rubella what medical tests do i need to undergo,you need to undergo a corneal transplant,0.1865430474281311,False,False,"The patient specifically asked, 'what medical tests do i need to undergo' following a diagnosis of congenital rubella. A corneal transplant is a surgical *treatment* for severe corneal damage or opacity, not a diagnostic *test*. While congenital rubella syndrome (CRS) can cause ocular manifestations including corneal clouding, a transplant is a specific intervention for a complication, not a general diagnostic procedure or a routine test for all CRS patients. The doctor's response does not address the patient's query about necessary tests.",Comprehensive Ophthalmologic Evaluation
doctor my baby has been very fussy and irritable lately im pretty sure hes going through teething syndrome,okay well need to perform a complete physical skin exam and other diagnostic procedures to confirm the diagnosispatient is there anything else we should do,0.2283056080341339,False,False,"The 'Doctor's Diagnosis (Output)' provided is not a medical diagnosis of a specific condition but rather a statement outlining the need for further diagnostic procedures, including a complete physical skin exam. Therefore, it cannot be assessed as 'correct' or 'incorrect' in relation to the patient's symptoms. The symptoms of fussiness and irritability in an infant are highly non-specific and require a thorough medical evaluation to determine the underlying cause.",Diaper Dermatitis
doctor i have been experiencing severe stomach pain nausea and vomiting and diarrhea i fear it might be an infectious gastroenteritis,i see in that case we need to run some medical tests to confirm the diagnosis and identify the underlying cause we will perform a complete blood count cbc kidney function test glucose measurement electrolytes panel and urinalysis additionally you will require intravenous fluid replacement to prevent dehydration,0.2285935878753662,False,True,"The patient's symptoms of severe stomach pain, nausea, vomiting, and diarrhea are classic and highly indicative of infectious gastroenteritis. This condition, often caused by viruses or bacteria, directly affects the gastrointestinal tract, leading to these specific symptoms. The doctor's diagnosis is well-supported by the presented clinical picture.",infectious gastroenteritis
doctor i have been experiencing some symptoms associated with von hippellindau disease,i see in that case we need to run some medical tests to make sure specifically we should begin with a magnetic resonance imaging mri scan a complete physical skin exam ml and a sigmoidoscopy or colonoscopy additionally we may need to perform some more invasive tests such as incision and excision of cns diagnostic spinal tap spinal tap and excision of skin lesion lastly we would also want to perform an occupational therapy assessment speech therapy,0.2859745323657989,False,True,"The patient explicitly states experiencing symptoms associated with Von Hippel-Lindau (VHL) disease. The diagnostic tests outlined by the doctor, including MRI (for CNS and other organs), a complete physical skin exam, sigmoidoscopy or colonoscopy (for gastrointestinal involvement), CNS diagnostic procedures (incision/excision, spinal tap), and excision of skin lesions, are all highly appropriate and standard for investigating and confirming a diagnosis of VHL disease, which is a multi-system genetic disorder. Occupational and speech therapy assessments are also relevant for managing potential neurological or other functional deficits that can arise from VHL.",Von Hippel-Lindau Disease
doctor i think i might have been poisoned by sedatives,im sorry to hear that im going to order some tests to help understand whats going on well need to do a complete blood count a kidney function test and a urinalysispatient ok what do those tests involve,0.2747021317481994,False,True,"The patient's reported symptom of suspected sedative poisoning warrants immediate medical investigation. The doctor's response, which involves ordering a Complete Blood Count (CBC), Kidney Function Test, and Urinalysis, represents an appropriate and standard initial diagnostic plan to assess the patient's condition, identify potential organ damage, and screen for substances. These tests are crucial steps in verifying or ruling out poisoning and guiding further treatment. The doctor is appropriately initiating the diagnostic process rather than prematurely making a definitive diagnosis.",im sorry to hear that im going to order some tests to help understand whats going on well need to do a complete blood count a kidney function test and a urinalysispatient ok what do those tests involve
doctor i think i am experiencing some extrapyramidal effects from my medication,alright we need to conduct some medical tests first you will require an electroencephalogram eeg to check your brains electrical activity additionally a cat scan of your head will be necessary to examine any physical abnormalities physical therapy exercises will also be required to help control your symptoms we will also start you on intravenous fluid replacement to ensure you remain hydrated,0.2708535492420196,False,False,"The patient explicitly states symptoms indicative of 'extrapyramidal effects from my medication.' Extrapyramidal symptoms (EPS) are a known side effect of certain medications, primarily antipsychotics. While a comprehensive neurological workup might be considered in complex or unclear cases, the initial diagnostic approach for suspected drug-induced EPS typically involves a detailed history, physical examination, and a thorough review of the patient's medication regimen to identify the causative agent. The doctor's proposed tests, an Electroencephalogram (EEG) and a CT scan of the head, are generally not the first-line diagnostic tools for confirming drug-induced EPS, which is primarily a functional movement disorder rather than one usually associated with structural brain abnormalities or primary electrical instability that these tests would reveal. Physical therapy and intravenous fluid replacement are supportive treatments, not primary diagnostic measures for EPS. The diagnostic plan does not directly address the likely cause suggested by the patient's complaint.",Drug-induced Extrapyramidal Symptoms
doctor i think i have chagas disease,okay we need to conduct a plain xray xray radiographic imaging procedure and a ct scan of your abdomen ct of abdomen,0.2525924444198608,False,False,"The patient explicitly states a suspicion of Chagas disease. The initial diagnostic approach for suspected Chagas disease primarily involves serological testing (blood tests for antibodies to Trypanosoma cruzi) to confirm the infection. While chronic Chagas disease can lead to complications affecting organs like the heart or digestive system (e.g., megaesophagus, megacolon) that might eventually warrant imaging studies, these are typically performed after an initial serological diagnosis is confirmed to assess the extent of organ damage or complications. Ordering a general plain X-ray and CT scan of the abdomen as the first response to a patient's self-diagnosis of Chagas disease is not the standard, most appropriate, or most efficient diagnostic approach, as these procedures do not directly confirm or rule out the Trypanosoma cruzi infection itself.",Chagas disease
hi doctor i have been experiencing unusual vaginal bleeding and have been feeling tired lately i think it might be something serious,based on your symptoms well need to perform a few tests to determine the cause of your symptoms well need to do a pelvis exam radiographic imaging procedure and a biopsy well also need to perform an examination of your breasts ultrasonography and other diagnostic procedures for female organs additionally well need to do a mammogram to rule out any breast abnormalities,0.2556216120719909,False,True,"The patient's symptoms of 'unusual vaginal bleeding' and 'feeling tired,' coupled with her concern that it 'might be something serious,' strongly warrant a comprehensive diagnostic investigation. Unusual vaginal bleeding necessitates ruling out various gynecological conditions, ranging from benign (e.g., polyps, fibroids) to more serious pathologies, including malignancies (e.g., endometrial, cervical cancer). The symptom of 'feeling tired' is non-specific but can be associated with anemia resulting from blood loss or an underlying systemic illness. The doctor's outlined diagnostic plan, which includes a pelvis exam, radiographic imaging, ultrasonography, and a biopsy, is highly appropriate for thoroughly evaluating abnormal uterine bleeding and potential underlying gynecological issues. The inclusion of a breast examination and mammogram, while not directly linked to vaginal bleeding, represents a prudent and comprehensive approach to female health screening, especially when a patient expresses concern about a 'serious' condition and a broad differential for serious conditions is being considered. The doctor is appropriately planning a thorough workup to determine the cause rather than making a premature diagnosis.",based on your symptoms well need to perform a few tests to determine the cause of your symptoms well need to do a pelvis exam radiographic imaging procedure and a biopsy well also need to perform an examination of your breasts ultrasonography and other diagnostic procedures for female organs additionally well need to do a mammogram to rule out any breast abnormalities
ive been having severe pelvic pain and abnormal vaginal bleeding my gynecologist thinks it might be an ectopic pregnancy,in that case we will need to run several medical tests first well need to do a complete blood count cbc and hematologic tests to assess your blood cell counts and clotting ability well also need to perform radiographic imaging procedures such as an ultrasound to visualize the location of the pregnancy a urinalysis will be useful in ruling out a urinary tract infection well also perform a standard pregnancy test and measure your glucose levels additionally intravenous fluid replacement may be necessary to stabilize your condition,0.2825592756271362,False,True,Severe pelvic pain and abnormal vaginal bleeding are classic and highly suggestive symptoms of an ectopic pregnancy. These symptoms are consistent with the gynecologist's initial suspicion and warrant immediate investigation for this condition.,Ectopic pregnancy
doctor ive been experiencing muscle spasms and tingling sensations in my fingers and toes i was diagnosed with pseudohypoparathyroidism a few years ago and i think its getting worse,in order to assess your condition we will need to perform a few medical tests we will start with a radiographic imaging procedure and a plain xray to get a better look at the affected areas we will also need to do a complete physical skin exam to check for any related symptoms additionally an electrolytes panel and liver function test will be required to assess your overall health depending on the results of these tests we may also need to do a magnetic resonance imaging mri to get a more detailed look at your condition lastly debridement of any wounds infections or burns should also be considered,0.2786648273468017,False,False,"The patient's symptoms of muscle spasms and tingling sensations, coupled with a self-reported history of pseudohypoparathyroidism (PHP) and a belief that it's worsening, are classic indicators of hypocalcemia, which is the primary metabolic derangement in PHP. The doctor's proposed plan includes an 'electrolytes panel,' which is highly appropriate and essential for confirming hypocalcemia and hyperphosphatemia in PHP. However, the inclusion of 'radiographic imaging procedure and a plain xray,' 'liver function test,' 'magnetic resonance imaging (MRI),' and especially 'debridement of any wounds infections or burns' are largely irrelevant or not primary diagnostic steps for an acute exacerbation of known pseudohypoparathyroidism presenting with hypocalcemic symptoms. While PHP can have skeletal manifestations (which imaging might assess over time), acute spasms and tingling primarily require immediate metabolic evaluation. Liver function tests and debridement are unrelated to the core pathophysiology of PHP. Therefore, while one crucial test is included, the overall diagnostic plan is unfocused and contains several inappropriate investigations for the presented clinical picture.",Worsening Pseudohypoparathyroidism
doctor i have been feeling down and depressed for a long time i wake up every morning feeling sad and anxious i feel like i am always in a low mood and cant seem to shake it off,i understand it sounds like you may be experiencing dysthymic disorder i recommend that you undergo a depression screen to confirm the diagnosis additionally you should undergo psychological and psychiatric evaluation to determine the best course of treatment which may include psychotherapy and mental health counseling as for the other tests you mentioned a lipid panel and toxicology screen would not be necessary for this particular condition finally varicose vein stripping is not related to this issue and is not required,0.2464428395032882,False,True,"The patient's symptoms, including feeling 'down and depressed for a long time,' waking up 'every morning feeling sad and anxious,' and being 'always in a low mood' that they 'can't seem to shake off,' are highly consistent with the diagnostic criteria for Dysthymic Disorder, also known as Persistent Depressive Disorder. This condition is characterized by a chronic, pervasive low mood that persists for an extended period (at least two years in adults). The description of the mood being 'for a long time' and 'every morning' strongly supports the chronicity and persistence central to this diagnosis. The doctor's recommendation for a depression screen, psychological and psychiatric evaluation, psychotherapy, and mental health counseling aligns with the standard management for Dysthymic Disorder.",Dysthymic Disorder (Persistent Depressive Disorder)
doctor i have pick disease what kind of medical tests do i need to take,you need to undergo a bone marrow transplant bmt,0.285601794719696,False,False,"The patient states having 'pick disease,' which is medically recognized as Pick's disease (a form of frontotemporal dementia). This is a neurodegenerative disorder primarily affecting the brain. The doctor's 'diagnosis' of 'you need to undergo a bone marrow transplant bmt' is incorrect. Firstly, a bone marrow transplant (BMT) is a medical treatment procedure, not a diagnosis. Secondly, BMT is typically used to treat conditions such as certain blood cancers (e.g., leukemia, lymphoma), severe aplastic anemia, or inherited immune/metabolic disorders, and is not a relevant treatment or associated with the diagnosis of Pick's disease.",Pick's disease
doctor i have been experiencing fever neck pain fatigue and weight loss i went to another doctor earlier who prescribed antibiotics to me but it hasnt helped at all can you help me,based on your symptoms i suspect that you may have subacute thyroiditis in order to confirm this diagnosis well need to do a few medical tests your first step will be to undergo hematologic tests such as a blood test well also need to perform a radiographic imaging procedure a urinalysis a pelvis exam ultrasonography and a glucose measurement finally well also need to examine your breast to confirm there are no abnormalities,0.2918062806129455,False,True,"The patient's symptoms of fever, neck pain, fatigue, and weight loss are highly consistent with subacute thyroiditis (De Quervain's thyroiditis). Neck pain, often radiating, is a hallmark symptom, frequently accompanied by fever and systemic symptoms like fatigue and malaise. Weight loss can occur, particularly during the initial hyperthyroid phase. The fact that antibiotics did not help further supports a non-bacterial, likely viral or inflammatory cause, which is typical for subacute thyroiditis. Therefore, the diagnosis is well-aligned with the presented symptoms.",Subacute thyroiditis
doctor i have been experiencing frequent bone fractures and weakness in my bones i also feel a lot of pain in my back and hips,based on your symptoms we will need to run some medical tests first we will need to conduct a hematologic test blood test to check your blood counts and screen for any underlying issues we will also perform a lipid panel to check your cholesterol levels in addition we need to conduct a complete physical skin exam performed ml to check for any signs of skin cancer we should also conduct a bone density scan to check the strength of your bones we also need to conduct an examination of your breasts and perform the mammography mammogram to check for breast cancer lastly we will conduct a pelvis exam to check for any abnormalities,0.2611381113529205,False,False,"The patient's symptoms – frequent bone fractures, weakness in bones, and pain in the back and hips – are highly indicative of a primary bone pathology such as osteoporosis or other metabolic bone diseases. While a bone density scan and a hematologic test are appropriate initial steps to investigate these symptoms, the diagnostic plan proposed by the doctor includes several tests (lipid panel, complete physical skin exam for skin cancer, breast exam and mammography for breast cancer, general pelvis exam for abnormalities) that are not directly or highly suggested by the specific bone-related complaints. These additional tests, while potentially part of a routine comprehensive check-up, do not specifically address the patient's presenting symptoms and distract from a focused investigation of the bone fragility.",Osteoporosis
doctor i think i might have contracted trichomonas infection i am experiencing discomfort during urination itching and a foulsmelling discharge,its important that we diagnose and treat your symptoms well need to run some medical tests first a urinalysis will be needed to check for any abnormalities in your urine following that well have to conduct some hematologic tests to check your blood a pelvis exam will also be necessary to check for any inflammation or tenderness in the abdomen or vaginal region a complete blood count and a kidney function test will then be carried out we will also need to perform a standard pregnancy test to rule out any possible pregnancy lastly well be measuring your glucose level to check for diabetes patient okay doctor i will take these tests as soon as possible,0.2594015002250671,False,False,"The doctor's output is a plan for diagnostic tests rather than a specific medical diagnosis. The patient's symptoms (discomfort during urination, itching, and a foul-smelling discharge) are highly suggestive of a urogenital infection, commonly vaginitis, and specifically align well with the patient's stated suspicion of Trichomonas infection or other common vaginal infections like bacterial vaginosis. While a pelvic exam and urinalysis are relevant to investigate these symptoms, the broad array of other tests (general hematologic tests, complete blood count, kidney function test, and glucose level for diabetes) are not primarily or specifically indicated for the initial workup of these particular symptoms without further contextual information. Since no definitive medical diagnosis of a condition was provided by the doctor, the symptoms cannot 'highly suggest' it as a diagnosis.",Trichomoniasis
doctor i think i might have marfan syndrome,alright we will need to do a radiographic imaging procedure an electrocardiogram ultrasonography ultrasound and echocardiography to confirm additionally we may need to perform an aortic resection replacement or anastomosis along with the conversion of cardiac rhythm defibrillation procedures lastly we need to do an hiv screen hiv test as well,0.2570916414260864,False,False,"The patient directly expressed concern about Marfan Syndrome, which is a genetic disorder affecting connective tissue. The majority of the diagnostic procedures (radiographic imaging, electrocardiogram, ultrasonography, echocardiography) and potential treatments (aortic resection/replacement/anastomosis, cardiac rhythm defibrillation) outlined by the doctor are highly relevant and appropriate for confirming and managing Marfan Syndrome, especially its common cardiovascular complications (e.g., aortic dilation, mitral valve prolapse). However, the inclusion of an 'HIV screen hiv test' is medically irrelevant to the diagnosis or management of Marfan Syndrome and is not suggested by the patient's reported concern.",Marfan Syndrome
doctor i have been experiencing fatigue weakness and jaundice my family has a history of anemia and i think i might have it too,based on your symptoms and family history i recommend a few tests we need to run some hematologic tests and a cbc to check your red blood cells health also we may need to check for any infections through blood culture i dont think psychotherapy corneal transplant or procedures on the spleen are necessary in this case removal of an ectopic pregnancy is also not applicable,0.2850107252597809,False,True,"The patient's symptoms of fatigue, weakness, and jaundice, combined with a family history of anemia, strongly suggest a potential hemolytic process or another form of anemia. Jaundice, in this clinical context, is highly indicative of increased red blood cell breakdown (pre-hepatic jaundice) or liver dysfunction, both of which can be associated with hematologic conditions. The doctor's recommendation for hematologic tests and a complete blood count (CBC) is the most appropriate initial diagnostic step to evaluate red blood cell health, confirm anemia, and investigate its underlying cause. Checking for infections through blood culture is also a relevant step, as infections can trigger or exacerbate hemolytic conditions. The explicit exclusion of unrelated procedures (psychotherapy, corneal transplant, spleen procedures, ectopic pregnancy removal) demonstrates a focused and medically sound approach, aligning the diagnostic plan directly with the patient's reported symptoms.",based on your symptoms and family history i recommend a few tests we need to run some hematologic tests and a cbc to check your red blood cells health also we may need to check for any infections through blood culture i dont think psychotherapy corneal transplant or procedures on the spleen are necessary in this case removal of an ectopic pregnancy is also not applicable
