input,output,similarity_score,not_logical,is_correct,reasoning,suggested_diagnosis
doctor i have been experiencing fainting burning chest pain cough dryness in my mouth and diminished vision what could be the problem,based on your symptoms you may be experiencing hyperosmotic hyperketotic state which can occur in people with uncontrolled type diabetes this is a serious condition that requires immediate medical attention,0.2985510230064392,False,False,"While symptoms such as fainting, dryness in the mouth, and diminished vision can be associated with severe dehydration and hyperglycemia as seen in a hyperosmolar hyperglycemic state (HHS), the prominent 'burning chest pain' and 'cough' are not typical or primary symptoms of HHS. Burning chest pain strongly suggests a cardiac (e.g., angina, myocardial infarction), pulmonary (e.g., pleurisy, pneumonia), or gastrointestinal issue, and a cough points directly to a respiratory pathology. Therefore, the complete set of presented symptoms does not highly suggest HHS as the most comprehensive diagnosis.",Pneumonia
doctor i am constantly thirsty no matter how much water i drink,based on your symptoms you may be experiencing a hyperosmotic hyperketotic state,0.2728440761566162,False,False,"Polydipsia (excessive thirst) is a classic symptom of uncontrolled Diabetes Mellitus due to hyperglycemia leading to osmotic diuresis and subsequent fluid loss. While a 'hyperosmotic hyperketotic state' is a severe metabolic complication that can arise from uncontrolled diabetes (e.g., Diabetic Ketoacidosis), it is not the primary diagnosis for the isolated symptom of constant thirst. The symptom itself most directly points to the underlying disease causing the thirst, rather than a specific, severe metabolic derangement without other accompanying symptoms like polyuria, weight loss, fatigue, abdominal pain, or altered mental status that would suggest a critical state.",Diabetes Mellitus
doctor ive been experiencing joint stiffness and tightness along with fatigue also ive noticed a strange lump or mass on my knee what could be the problem,based on your symptoms its possible that you have a fat embolism this occurs when small globs of fat circulate in your blood and become lodged in your blood vessels leading to restricted blood flow and reduced oxygen supply to your tissues,0.2773617804050445,False,False,"The doctor's diagnosis of a fat embolism does not align with the patient's reported symptoms. A fat embolism is an acute, systemic condition typically associated with major trauma (like long bone fractures) or surgery, and its primary symptoms include respiratory distress, neurological dysfunction, and a petechial rash. Joint stiffness, tightness, and especially a localized 'lump or mass on my knee' are not characteristic symptoms of a fat embolism. The presence of a localized lump on the knee combined with joint stiffness and fatigue strongly suggests a localized musculoskeletal issue rather than a systemic circulatory problem.",Baker's cyst (Popliteal cyst)
doctor i have been experiencing shoulder cramps and spasms lately i also feel tired often and have been having pain in my eye what could be wrong with me,it is possible that you are experiencing symptoms of fat embolism have you had any recent injuries or surgeries,0.2571937441825866,False,False,"The patient's reported symptoms of shoulder cramps and spasms, persistent fatigue, and eye pain do not align with the typical presentation of a fat embolism. Fat embolism syndrome is usually characterized by respiratory distress, neurological deficits (e.g., confusion, agitation, disorientation), and a petechial rash, often occurring after major trauma or surgery. The patient does not describe these hallmark symptoms. While 'pain in my eye' could potentially be very vaguely linked to retinal changes in severe FES, it is not a primary or characteristic symptom, and the other symptoms are inconsistent. The constellation of muscle cramps/spasms, chronic fatigue, and eye pain is more suggestive of other neurological or autoimmune conditions.",Multiple Sclerosis
doctor i have been experiencing weight gain itching of skin regurgitation symptoms of eye and joint pain lately what could be the reason for these symptoms,it seems like you might be suffering from polycythemia vera a rare blood disorder that causes your body to produce excess red blood cells these symptoms are quite common in patients with this disease,0.2881361842155456,False,False,"While pruritus (itching) and joint pain can be associated with Polycythemia Vera (PV), weight gain is not a typical symptom; patients with PV are more likely to experience weight loss due to an increased metabolic rate. Furthermore, 'regurgitation symptoms of eye' is an unusual and vague description, and not a recognized or common ocular manifestation directly linked to PV. The constellation of symptoms, particularly the weight gain, does not highly suggest Polycythemia Vera.",Hypothyroidism
doctor i have a lump in my throat what could be the reason,based on your symptoms you might have a goiter,0.2735136747360229,False,True,"A goiter is an enlargement of the thyroid gland, which is located in the neck. A common symptom of a goiter is a visible or palpable lump in the throat or neck area. Patients often describe this as a 'lump in my throat' or a sensation of fullness. Therefore, the symptom highly suggests a goiter as a plausible and common diagnosis.",goiter
doctor i have been experiencing double vision fatigue nasal congestion cough and weakness do you have any idea what could be causing these symptoms,yes after considering your symptoms i believe you may have muscular dystrophy unfortunately there is no cure for this disease but we can work together to manage your symptoms and improve your quality of life,0.2475338727235794,False,False,"The symptoms provided do not highly suggest muscular dystrophy. Muscular dystrophy is characterized by progressive muscle weakness and fatigue, but typically does not present with double vision, nasal congestion, or cough as primary or early symptoms. Double vision strongly indicates an issue with the extraocular muscles or neurological control, while nasal congestion and cough are more indicative of a respiratory infection or allergy, or in some contexts, a systemic inflammatory process. These specific symptoms are not consistent with a typical presentation of muscular dystrophy.",Myasthenia Gravis
doctor i am having difficulty in swallowing cough groin pain and coryza what could be the problem,based on your symptoms i believe you may have scarlet fever,0.2459645569324493,False,False,"Scarlet fever is a bacterial infection typically presenting with a sore throat, fever, rash, and strawberry tongue, but it generally lacks prominent coryza (runny nose/nasal congestion) and cough, which are characteristic of viral upper respiratory infections. Furthermore, groin pain is a highly atypical symptom for scarlet fever. The combination of coryza, cough, and difficulty swallowing points away from scarlet fever and more towards a viral etiology. While difficulty swallowing can occur, the other symptoms contradict a scarlet fever diagnosis.",Viral Upper Respiratory Infection
doctor i have been feeling so angry lately and its been hard to control it,have you been using any drugs or substances recently patient yes i have been using cocaine occasionally,0.2890761494636535,False,True,"Anger, irritability, and difficulty controlling emotions are well-documented psychological and behavioral effects of cocaine use. Cocaine, a potent stimulant, can lead to mood dysregulation, agitation, and increased aggression, particularly during intoxication or chronic use. Given the patient's admission of occasional cocaine use in response to the doctor's query, the connection between the symptoms and the substance is highly plausible and medically sound.",Cocaine-induced mood disorder (with prominent anger and irritability)
doctor i have an open wound on my cheek and fluid seems to be accumulating in the area what do you think it could be,based on your symptoms i believe you have a condition called a mucocele,0.289859265089035,False,False,"A mucocele is typically a closed, mucus-filled cyst resulting from trauma to a minor salivary gland duct, usually found on the oral mucosa (lips, inner cheek). While a mucocele can rupture and drain, the description 'open wound on my cheek and fluid seems to be accumulating in the area' more strongly suggests an active infection or a collection of pus. An abscess, which is a localized collection of pus often caused by bacterial infection, commonly presents with swelling that may eventually form an 'open wound' (e.g., a draining fistula or spontaneous rupture) with ongoing 'fluid' (pus) accumulation. This presentation aligns more closely with the patient's symptoms than a typical mucocele.",Abscess
doctor i have been experiencing diminished hearing weakness and disturbance of memory lately what is wrong with me,you might have a meningioma its a type of brain tumor that develops in the protective tissue surrounding the brain and spinal cord i suggest we run some tests to confirm the diagnosis,0.2957641184329986,False,False,"The patient's symptoms of diminished hearing, weakness, and disturbance of memory are general neurological complaints. While a meningioma, a type of brain tumor, can potentially cause these symptoms depending on its size and location (e.g., affecting auditory pathways, motor cortex, or memory centers), these symptoms are not specific enough to 'highly suggest' a meningioma over several other conditions. The diagnosis of meningioma is plausible but not highly suggested by this symptom constellation alone. There are more common and often treatable conditions that can present with a similar combination of neurological symptoms.",Vitamin B12 Deficiency
doctor i have been experiencing melena which is black tarry stool what could be the reason for this,based on your symptoms it is possible that you are suffering from primary kidney disease which affects the functionality of your kidneys leading to such symptoms it is important that we perform further tests to ascertain the exact diagnosis,0.2636099755764007,False,False,"Melena, characterized by black tarry stools, is a classic sign of upper gastrointestinal bleeding. The black color indicates that blood has been digested as it passes through the GI tract. Primary kidney disease, on the other hand, primarily affects renal function and typically presents with symptoms such as edema, hypertension, fatigue, changes in urine output, and electrolyte imbalances. While severe kidney disease can indirectly lead to gastrointestinal issues, including bleeding, due to uremia-induced gastritis or platelet dysfunction, it is not the most direct or common cause of melena, nor is melena a primary diagnostic symptom for kidney disease itself. The doctor's reasoning does not directly link kidney dysfunction to the symptom of melena.",Peptic Ulcer Disease
doctor ive been having some gum pain lately what could it be,well based on your medical history and current symptoms i would like to investigate further to check if you have uterine cancer,0.2155700623989105,False,False,"Gum pain is a localized symptom typically indicating issues within the oral cavity, such as dental problems (e.g., cavities, abscesses), gingivitis, periodontitis, or other oral infections. Uterine cancer, however, is a gynecological malignancy affecting the uterus, and its symptoms typically include abnormal vaginal bleeding, pelvic pain, or changes in bowel/bladder habits. There is no medical correlation between gum pain and uterine cancer, making the given diagnosis highly improbable based solely on the provided symptom.",Gingivitis
doctor ive been experiencing joint stiffness and ankle pain do you know whats wrong with me,based on your symptoms its possible that you have leptospirosis have you been in contact with contaminated water or animals recently,0.2331810891628265,False,False,"Leptospirosis typically presents with flu-like symptoms such as high fever, severe headache, muscle aches (myalgia), chills, vomiting, and sometimes rash, conjunctival suffusion, or more severe organ involvement, often following exposure to contaminated water or animals. While joint pain can occur, 'joint stiffness' and 'ankle pain' as the primary complaints without other systemic symptoms or a clear exposure history do not highly suggest leptospirosis. These symptoms are much more indicative of an inflammatory or degenerative joint condition.",Rheumatoid Arthritis
doctor i have been experiencing ankle pain excessive anger pain or soreness of breast and a knee lump what could be the problem,based on your symptoms it is possible that you are suffering from leptospirosis a bacterial infection caused by exposure to contaminated water or soil you should undergo some tests to confirm the diagnosis and get treatment as soon as possible,0.239884540438652,False,False,"The symptoms provided do not highly suggest Leptospirosis. Leptospirosis is an acute bacterial infection typically characterized by fever, severe muscle aches (often in the calves), headache, chills, and conjunctival suffusion. The patient's reported symptoms of 'excessive anger,' 'pain or soreness of breast,' and a 'knee lump' are not characteristic of Leptospirosis. Instead, these symptoms point towards a condition that involves widespread pain, mood disturbances, and potentially localized musculoskeletal issues.",Fibromyalgia
doctor ive been experiencing joint stiffness and tightness excessive anger fatigue and wrist pain what could be causing all of these symptoms,based on your symptoms it sounds like you could be experiencing leptospirosis a bacterial infection commonly transmitted through contact with contaminated water or soil i suggest we run some tests to confirm the diagnosis and begin treatment as soon as possible,0.277158111333847,False,False,"Leptospirosis is a bacterial infection typically presenting with acute symptoms such as fever, headache, muscle aches, chills, and conjunctivitis, often after exposure to contaminated water or soil. While some general aches and fatigue might be present, 'excessive anger' is not a characteristic or primary symptom of leptospirosis. The combination of chronic joint stiffness, tightness, fatigue, wrist pain, and notably, 'excessive anger,' does not highly suggest leptospirosis. These symptoms are more indicative of conditions affecting both physical and psychological well-being.",Fibromyalgia
doctor ive been experiencing pain during my pregnancy pain in my eye and facial pain what could be causing these symptoms,based on the symptoms youve described its possible that you have leptospirosis ill need to do some tests to confirm the diagnosis but its important that you seek treatment as soon as possible,0.2443606257438659,False,False,"The patient's reported symptoms of 'pain during my pregnancy, pain in my eye, and facial pain' do not strongly align with the typical presentation of Leptospirosis. Common symptoms of Leptospirosis include fever, muscle aches, chills, headache, and conjunctival suffusion (red eyes), often accompanied by exposure history to contaminated water or animals. While eye pain can occur in some forms of Leptospirosis (e.g., uveitis), and headache can contribute to facial pain, the absence of other systemic symptoms like fever and myalgia, along with the specific emphasis on 'pain in my eye and facial pain,' makes Leptospirosis a less likely primary diagnosis without further information. The combination of severe unilateral eye and facial pain is more suggestive of primary headache disorders.",Cluster Headache
doctor ive been experiencing vomiting and leg pain whats wrong with me,you may be suffering from vertebrobasilar insufficiency which is caused by a decreased blood flow to your brainstem and cerebellum due to a narrowing or blockage in your vertebral or basilar arteries it can also cause other symptoms like dizziness difficulty speaking and vision problems,0.2641935348510742,False,False,"Vertebrobasilar insufficiency (VBI) primarily presents with neurological symptoms such as dizziness, vertigo, visual disturbances, difficulty speaking (dysarthria), and balance problems (ataxia), due to decreased blood flow to the brainstem and cerebellum. While nausea and vomiting can sometimes be associated, isolated leg pain is not a characteristic or primary symptom of VBI. A more common and directly linked explanation for concurrent vomiting and leg pain is dehydration and electrolyte imbalance resulting from prolonged vomiting, which can lead to muscle cramps or generalized myalgia.",Dehydration and Electrolyte Imbalance
doctor ive been experiencing difficulty speaking drainage in my throat and my bones have become painful im also experiencing pelvic and joint pain what could this be,based on your symptoms it seems like you may have hemochromatosis a condition where there is an excess buildup of iron in the body treatment options include regular blood removal to reduce iron levels and management of symptoms we will need to do some lab tests to confirm the diagnosis,0.2121872305870056,False,False,"While hemochromatosis can cause joint pain and, less commonly, bone pain, the patient's reported symptoms of 'difficulty speaking' (dysarthria/dysphonia) and 'drainage in my throat' (potentially indicating dysphagia, reflux, or pharyngeal irritation) are not typical or primary manifestations of hemochromatosis. These specific symptoms suggest a condition with broader systemic involvement, potentially affecting musculoskeletal, neurological, and gastrointestinal systems concurrently, which is not characteristic of iron overload alone.",Scleroderma (Systemic Sclerosis)
doctor i have been experiencing pelvic pain and my bones are painful as well what could be the cause,based on your symptoms it is possible that you have hemochromatosis which is an inherited condition that causes excess iron buildup in the body,0.2821037471294403,False,False,"Hemochromatosis is an inherited condition causing iron overload, which can lead to arthropathy (joint pain), often affecting the small joints of the hands, hips, knees, and shoulders. However, 'pelvic pain' is not a characteristic or primary symptom of hemochromatosis. While general joint pain might be described as 'bone pain', the combination with specific 'pelvic pain' does not highly suggest hemochromatosis as the most likely diagnosis. The symptoms are more consistent with other conditions.",Ankylosing Spondylitis
doctor i have been experiencing shoulder pain and some emotional symptoms recently what could be the problem,it sounds like you may be experiencing symptoms of cushing syndrome have you noticed any other changes in your body or mood,0.2891692221164703,False,False,"The symptoms of shoulder pain and emotional symptoms are highly non-specific and do not strongly point towards Cushing syndrome. While Cushing syndrome can involve emotional lability and musculoskeletal pain (often due to osteoporosis or muscle weakness), it typically presents with more characteristic physical signs such as moon face, buffalo hump, central obesity, skin thinning, and purple striae. These hallmark symptoms are absent in the provided information, making Cushing syndrome an unlikely primary diagnosis based solely on the given symptoms.",Generalized Anxiety Disorder
doctor i have been experiencing pain during pregnancy wrist pain and pain or soreness of breast what could be the reason for these symptoms,based on your symptoms it is possible that you have typhoid fever it is important that we conduct further tests to confirm this diagnosis and begin treatment immediately,0.2198260277509689,False,False,"The symptoms provided – 'pain during pregnancy', 'wrist pain', and 'pain or soreness of breast' – do not align with the typical presentation of typhoid fever. Typhoid fever is a systemic infection characterized by high fever, fatigue, headache, abdominal pain, and sometimes a rash (rose spots). Wrist pain and breast soreness are not characteristic symptoms of typhoid fever. Instead, these symptoms are commonly experienced during pregnancy. Breast pain and soreness are very common in early pregnancy due to hormonal changes, and wrist pain, often due to carpal tunnel syndrome, is also prevalent in pregnancy duearchical to fluid retention. Therefore, a diagnosis of typhoid fever is highly unlikely based on the presented symptoms.",Normal physiological changes of pregnancy
doctor ive been feeling a lot of pelvic pressure lately and noticed excessive growth in some areas whats going on with my body,based on your symptoms its possible that you may have contracted trichinosis a parasitic infection caused by eating undercooked or raw pork or wild game you need to get a proper diagnosis and treatment as soon as possible,0.1695763319730758,False,False,"The patient's symptoms of 'pelvic pressure' and 'excessive growth in some areas' are inconsistent with trichinosis. Trichinosis is a parasitic infection typically presenting with gastrointestinal symptoms (nausea, diarrhea, abdominal pain) followed by muscle pain, fever, and swelling, but not localized excessive growth or specific pelvic pressure. The reported symptoms strongly suggest the presence of a mass or enlargement within the pelvic region.",Uterine fibroids
hi doctor i noticed a lump on my knee and its been bothering me for a while do you know what it could be,based on the symptoms you described its possible that you may have trichinosis have you recently consumed undercooked or raw meat,0.2159090042114257,False,False,"The patient's symptom is a localized 'lump on my knee' that has been bothering them for a while. Trichinosis is a systemic parasitic infection typically characterized by widespread muscle pain, tenderness, swelling (often generalized, not an isolated lump), gastrointestinal symptoms, fever, and fatigue, usually following consumption of undercooked meat. An isolated lump on the knee is not a primary or typical presentation of trichinosis, making the doctor's diagnosis highly unlikely based solely on the described symptom.",Bursitis
doctor i have been experiencing shoulder swelling neck cramps or spasms sharp abdominal pain bedwetting and also excessive growth whats happening to me,you seem to be displaying the symptoms of trichinosis it is a parasitic disease caused by ingesting undercooked pork that is infected with the larvae of the trichinella worm,0.2749552130699157,False,False,"The doctor's diagnosis of Trichinosis is unlikely to be correct given the full spectrum of symptoms presented. While shoulder swelling, neck cramps or spasms, and sharp abdominal pain can be manifestations of Trichinosis (indicating muscle inflammation and gastrointestinal involvement), the symptom of 'excessive growth' is completely inconsistent with this parasitic infection. Trichinosis is an acute to subacute infection and does not cause chronic systemic growth abnormalities. Additionally, 'bedwetting' is not a typical symptom of Trichinosis. The presence of 'excessive growth' is a significant indicator pointing towards a different underlying condition.",Gigantism
doctor i have been experiencing pelvic pressure painful urination and sharp abdominal pain can you tell me whats wrong with me,based on your symptoms it seems like you might have trichinosis a parasitic disease caused by eating raw or undercooked meat especially pork you need to get tested and treated as soon as possible,0.2043186277151107,False,False,"The patient's symptoms of pelvic pressure, painful urination (dysuria), and sharp abdominal pain are highly suggestive of a urinary tract infection (UTI) or other genitourinary issues. Trichinosis, a parasitic infection acquired from consuming raw or undercooked meat, typically presents with gastrointestinal symptoms (e.g., diarrhea, nausea, generalized abdominal pain) followed by muscle pain, fever, and periorbital edema as the larvae migrate. Pelvic pressure and painful urination are not characteristic primary symptoms of trichinosis. Therefore, trichinosis is an unlikely diagnosis based on the reported symptoms.",Urinary Tract Infection (UTI)
doctor ive been experiencing fluid retention pain during pregnancy pain of the anus and leg cramps or spasms what could be the problem,it sounds like you may be experiencing symptoms of subacute thyroiditis this condition is an inflammation of the thyroid gland that causes pain and discomfort in the neck as well as other symptoms such as those youve described,0.2388298660516739,False,False,"The patient's symptoms, particularly 'pain of the anus,' 'fluid retention,' and 'leg cramps or spasms' during pregnancy, do not align with a diagnosis of subacute thyroiditis. Subacute thyroiditis typically presents with neck pain, thyroid tenderness, fever, and symptoms of hyperthyroidism followed by hypothyroidism. The patient did not report neck pain, which is a hallmark symptom of subacute thyroiditis. While fluid retention and leg cramps are very common during pregnancy and can be non-specific, 'pain of the anus' is a highly specific symptom that is not explained by thyroiditis. Instead, 'pain of the anus' in pregnancy strongly suggests a localized issue such as hemorrhoids or an anal fissure.",Hemorrhoids
