input,output,similarity_score,not_logical,is_correct,reasoning,suggested_diagnosis
doctor i have been experiencing back pain for the past week,do you also have any restlessness in your legs when youre lying down or sitting for long periods of time patient now that you mention it yes i have found myself moving my legs around a lot when i am lying down,0.1570505797863006,False,False,"The initial symptom provided by the patient, 'back pain for the past week', is a very common and non-specific symptom. It does not, on its own, highly suggest Restless Legs Syndrome (RLS). RLS is primarily characterized by an irresistible urge to move the legs, often accompanied by uncomfortable sensations, which are typically worse during periods of rest or inactivity and partially or totally relieved by movement. While the doctor's follow-up questions successfully elicited classic RLS symptoms (restlessness in legs when lying down or sitting for long periods, moving legs around a lot), the initial patient complaint of 'back pain' itself does not highly suggest this diagnosis.","Acute Musculoskeletal Back Pain (e.g., muscle strain or sprain)"
doctor i have been experiencing cramps and spasms as well as lower abdominal pain,based on your symptoms it appears that you may have undergone an induced abortion recently it is important to disclose any recent medical procedures to your healthcare provider in order to receive proper care have you recently undergone an abortion,0.2605539560317993,False,False,"The symptoms of 'cramps and spasms as well as lower abdominal pain' are highly non-specific and can be attributed to numerous conditions, including gynecological (e.g., dysmenorrhea, ectopic pregnancy, miscarriage), gastrointestinal (e.g., gastroenteritis, IBS), or urological issues (e.g., UTI). While an induced abortion can certainly present with these symptoms, these symptoms alone do not 'highly suggest' it over many other more common possibilities without additional context, such as a missed period, positive pregnancy test, or a patient's disclosure of a recent procedure. The doctor's diagnosis appears to be a speculative jump without sufficient supporting evidence from the provided symptoms.",Dysmenorrhea (menstrual cramps)
hi doctor ive been having trouble sleeping lately and have been drinking a lot of alcohol to try and help me sleep,based on what youve described it sounds like you may be struggling with a substancerelated mental disorder,0.255708634853363,False,True,"The patient explicitly states they are 'drinking a lot of alcohol to try and help me sleep' due to 'trouble sleeping lately'. This directly indicates the use of a substance (alcohol) in a potentially problematic way to cope with a mental health symptom (insomnia). The diagnosis of a 'substance-related mental disorder' is an appropriate umbrella term covering both substance use disorders (e.g., Alcohol Use Disorder) and substance-induced mental disorders (e.g., Alcohol-Induced Sleep Disorder), both of which are strongly suggested by the patient's description.",substancerelated mental disorder
doctor i have been having nosebleeds muscle swelling loss of sensation and nausea what could be causing this,these symptoms are indicative of a pituitary adenoma its a noncancerous tumor in the pituitary gland that causes hormonal imbalances and can lead to various symptoms including the ones you have mentioned we need to conduct some tests to confirm the diagnosis,0.2819129824638366,False,False,"The symptoms provided – nosebleeds, muscle swelling, loss of sensation, and nausea – do not strongly align with the typical presentation of a pituitary adenoma. Pituitary adenomas commonly cause symptoms related to hormonal imbalances (e.g., galactorrhea, amenorrhea, acromegaly, Cushing's syndrome) or mass effect (e.g., headaches, visual field defects like bitemporal hemianopsia). While acromegaly can lead to soft tissue swelling and headaches might cause nausea in severe cases, nosebleeds and significant 'loss of sensation' (suggesting neuropathy) are not characteristic primary symptoms of pituitary adenomas. A diagnosis like Granulomatosis with Polyangiitis (GPA), a systemic vasculitis, better explains this constellation of symptoms, as it can cause upper respiratory tract involvement (leading to nosebleeds), myalgia/muscle inflammation, peripheral neuropathy (causing loss of sensation), and general constitutional symptoms including nausea.",Granulomatosis with Polyangiitis (GPA)
doctor my eye has been really bothering me its red swollen and itchy,it sounds like you may be experiencing a chalazion,0.2563699781894684,False,False,"A chalazion is typically a painless (or mildly tender if inflamed) lump on the eyelid, and while it can cause some swelling and redness, it is not primarily characterized by itchiness. The combination of redness, swelling, and particularly intense itchiness is highly indicative of allergic conjunctivitis, where an immune response to an allergen causes inflammation of the conjunctiva, leading to these classic symptoms.",Allergic Conjunctivitis
doctor i have been experiencing knee swelling lower abdominal pain and skin swelling what could be the cause of this,based on your symptoms you might be suffering from ovarian torsion have you experienced any other symptoms such as nausea and vomiting,0.149315595626831,False,False,"Ovarian torsion is primarily characterized by sudden, severe, unilateral lower abdominal pain, often accompanied by nausea and vomiting. The patient's reported symptoms of knee swelling and generalized skin swelling are not typical manifestations of ovarian torsion. In contrast, hereditary angioedema (HAE) is a condition known for recurrent episodes of skin swelling (angioedema) and abdominal pain due to edema of the intestinal wall. While knee swelling is less commonly highlighted, joint swelling can occur during HAE attacks, making it a more comprehensive explanation for all three reported symptoms than ovarian torsion.",Hereditary Angioedema
doctor i have been experiencing sharp abdominal pain recently,based on your symptoms it seems like you may be suffering from a vaginal yeast infection,0.2241055965423584,False,False,"Sharp abdominal pain is a non-specific symptom that can indicate a wide range of conditions affecting the gastrointestinal, urinary, or reproductive systems, among others. A vaginal yeast infection (candidiasis) primarily presents with symptoms such as vaginal itching, burning, abnormal discharge (often thick, white, and 'cottage cheese-like'), and sometimes pain or discomfort during intercourse or urination. Sharp abdominal pain is not a typical or primary symptom of a vaginal yeast infection, making the given diagnosis highly unlikely based solely on the symptom provided.",Acute Gastroenteritis
doctor i have been experiencing fluid in my ear along with fever facial pain and redness in my ear what could be the issue,based on your symptoms it seems that you are suffering from a condition called mastoiditis,0.2730638384819031,False,True,"The patient's symptoms of fluid in the ear (ear discharge), fever, facial pain, and redness in the ear are highly consistent with mastoiditis. Mastoiditis is typically a complication of an untreated or severe middle ear infection (otitis media), where the infection spreads to the mastoid bone behind the ear. The presence of fever and ear discharge strongly indicates an active infection. Facial pain and prominent redness, especially if located behind the ear or extending from the ear, suggest a more extensive inflammatory process beyond a simple ear infection, which aligns well with the diagnosis of mastoiditis. While some symptoms overlap with severe acute otitis media, the constellation, particularly the facial pain, points to a more serious complication.",mastoiditis
doctor lately i have been experiencing a terrible headache and back pain,well it seems that you might have a lung contusion,0.2311754077672958,False,False,"Headache and back pain are not typical or primary symptoms of a lung contusion. A lung contusion usually presents with symptoms directly related to chest trauma and lung injury, such as chest pain, shortness of breath, coughing (potentially with blood), and signs of respiratory distress. The symptoms provided, 'terrible headache and back pain,' do not align with the characteristic presentation of a lung contusion.",Viral Infection
doctor i have been experiencing foot or toe pain lately,thats unfortunate however your symptoms are not related to the disease you have im sorry to inform you that you have endophthalmitis,0.2807358205318451,False,False,"Endophthalmitis is a severe inflammation of the interior of the eye, typically presenting with symptoms such as severe eye pain, redness, decreased vision, and light sensitivity. Foot or toe pain is a musculoskeletal symptom that is entirely unrelated to endophthalmitis. Therefore, the doctor's diagnosis is inconsistent with the patient's reported symptoms.",Arthritis
doctor i have been experiencing ankle pain fatigue joint stiffness and pain in my eyes what could be the cause,based on the symptoms you mentioned it is possible that you are suffering from lead poisoning you should get yourself checked immediately as it could be very harmful,0.2496263980865478,False,False,"The patient's symptoms of ankle pain, fatigue, joint stiffness, and pain in the eyes are not highly characteristic of lead poisoning. While lead poisoning can cause fatigue and general joint aches (arthralgia), 'joint stiffness' is not a primary or prominent feature, and 'pain in the eyes' is not a typical symptom. These symptoms, particularly the combination of joint pain/stiffness, fatigue, and ocular discomfort, are more indicative of a systemic inflammatory or autoimmune condition.",Systemic Lupus Erythematosus (SLE)
doctor i have been experiencing excessive urination at night and shoulder cramps or spasms what could it be,based on your symptoms it is possible that you are experiencing lead poisoning have you been exposed to lead in your workplace or at home,0.2018010020256042,False,False,"The combination of excessive urination at night (nocturia) and shoulder cramps or spasms is not highly indicative of lead poisoning. While chronic lead poisoning can affect kidney function and lead to some neuromuscular issues, nocturia is not a primary or specific early symptom, and muscle cramps/spasms are generally not the most prominent neurological manifestation. Other conditions more commonly present with these two symptoms.",Diabetes Mellitus
doctor ive been experiencing shoulder cramps or spasms pain during pregnancy pain or soreness of breast and also facial and ankle pain what could be the reason behind it,based on your symptoms it seems like you might be suffering from lead poisoning it is a condition caused by exposure to lead which can lead to the symptoms you just mentioned,0.2739705443382263,False,False,"The symptoms provided, particularly breast pain/soreness and generalized musculoskeletal pains (shoulder, ankle), are very common physiological discomforts during pregnancy due to hormonal changes, weight gain, and altered biomechanics. Facial pain, while less specific, can also arise from various pregnancy-related factors like sinusitis or headaches. While lead poisoning can cause joint and muscle pain, it typically presents with a different constellation of symptoms, such as severe abdominal pain, constipation, neurological issues, fatigue, and cognitive impairments, and does not commonly manifest with breast pain or primarily diffuse musculoskeletal discomforts in this manner. The doctor's diagnosis of lead poisoning is highly unlikely given the provided symptom profile, especially when viewed through the lens of pregnancy.",Normal physiological changes and common discomforts of pregnancy
doctor i have been feeling very angry and frustrated lately and to add to that i am also having severe pain in my ankle,based on your symptoms i suspect you might have lead poisoning have you been in contact with lead or leadbased products recently,0.2287493497133255,False,False,"The patient's symptoms of feeling very angry and frustrated, combined with severe pain in their ankle, do not highly suggest lead poisoning. While lead poisoning can cause irritability and diffuse muscle/joint pain (arthralgia/myalgia), severe, localized ankle pain is not a primary or highly specific symptom. The combination of these symptoms points more strongly towards an acute musculoskeletal issue in the ankle, with the emotional distress potentially being a secondary effect of dealing with significant pain and limited mobility, or an unrelated co-occurring issue.",Ankle sprain
doctor i have been having pain in my eye and i just noticed a lump on my knee do you know what could be causing this,based on your symptoms it is possible that you may be suffering from lead poisoning have you been exposed to lead recently,0.1924125105142593,False,False,"The reported symptoms of 'pain in my eye' and 'a lump on my knee' are not typical or specific manifestations of lead poisoning. Lead poisoning primarily affects the gastrointestinal, neurological, hematological, and renal systems, commonly presenting with symptoms like abdominal pain, constipation, headaches, fatigue, and neuropathy. Localized lumps on joints and general eye pain are not hallmark symptoms of lead toxicity, making the diagnosis highly unlikely based on the provided information.",Sarcoidosis
doctor im experiencing cramps and spasms along with a headache fever redness in my ear and a cough what could be wrong,it sounds like you may be suffering from hyperhidrosis a condition that causes excessive sweating beyond what is necessary to regulate body temperature however your symptoms are not typical of hyperhidrosis and i would like to do some further examination to make sure we have a proper diagnosis,0.1824594140052795,False,False,"Hyperhidrosis is a condition characterized by excessive sweating. The patient's symptoms, which include cramps, spasms, headache, fever, redness in the ear, and a cough, are not typical for hyperhidrosis. These symptoms strongly suggest an acute infectious process, particularly with inflammatory signs such as fever and localized redness in the ear, along with systemic symptoms like headache, cough, and myalgia (cramps and spasms). The doctor's statement, 'however your symptoms are not typical of hyperhidrosis', further confirms this incongruity.",Otitis Media
doctor i have noticed a lump on my hip and am experiencing headaches and some depressive symptoms do you know what could be causing these,yes it sounds like you may be experiencing symptoms of normal pressure hydrocephalus have you noticed any difficulty with walking balance or urinary incontinence,0.2952703237533569,False,False,"Normal Pressure Hydrocephalus (NPH) is characterized by a classic triad of gait disturbance, urinary incontinence, and cognitive impairment. While headaches and depressive symptoms can be associated with NPH, the presence of 'a lump on my hip' is a significant symptom that is not typically part of the NPH clinical picture. The doctor's diagnosis of NPH appears to overlook or not account for this prominent peripheral finding, making it highly unlikely to be the primary cause of all reported symptoms.",Cancer with suspected metastases
doctor i have been experiencing regurgitation joint pain nosebleeds nausea and diarrhea do you have any idea what might be wrong,based on your symptoms its possible that you have nonalcoholic liver disease nash well need to run some tests to confirm the diagnosis,0.2705515027046203,False,False,"NASH (Nonalcoholic Steatohepatitis) is a form of liver disease. Its typical symptoms include fatigue, weakness, dull right upper quadrant pain, and in advanced stages, jaundice, ascites, and easy bruising/bleeding. The reported symptoms of regurgitation and prominent joint pain are not characteristic or direct manifestations of NASH. While nausea, diarrhea, and nosebleeds can occur in various conditions, including some liver diseases (especially advanced ones), their combination with significant joint pain and regurgitation does not highly suggest NASH as the primary diagnosis. This cluster of symptoms points more towards a systemic inflammatory or autoimmune process.",Systemic Lupus Erythematosus (SLE)
doctor i have been experiencing excessive growth and headaches lately do you have any idea what might be causing this,these symptoms might be caused by an abscess of the lung its a localized collection of pus in the lung that can cause fever shortness of breath chest pain and coughing up blood we need to do further tests to confirm the diagnosis,0.2435163110494613,False,False,"The patient's reported symptoms of 'excessive growth' and 'headaches' do not align with the typical presentation of an 'abscess of the lung'. Lung abscesses are characterized by symptoms such as fever, cough (often productive), chest pain, shortness of breath, and sometimes hemoptysis. The symptoms provided by the patient are more indicative of a condition related to hormonal imbalance or a mass effect within the skull.",Acromegaly
doctor i have been experiencing wrist pain and i have noticed a lump on my knee what could be causing this,based on your symptoms it is possible that you have dengue fever have you experienced any other symptoms such as fever or headaches,0.2556442022323608,False,False,"Dengue fever is a systemic viral infection characterized by symptoms such as high fever, severe joint and muscle pain (arthralgia/myalgia, often called 'breakbone fever'), headache, rash, and pain behind the eyes. It does not cause localized lumps or masses on the knee or other joints. While wrist pain could be part of the generalized arthralgia in dengue, the presence of a distinct 'lump on my knee' is inconsistent with a diagnosis of dengue fever.",Rheumatoid Arthritis
doctor i have been experiencing throat irritation blood in stool low selfesteem and depression i must also admit that i have been abusing alcohol,have you been taking any painkillers or analgesics recentlypatient yes i have been taking them almost every day for my headaches,0.2889821827411651,False,True,"The patient's symptoms of throat irritation and blood in stool, especially when combined with a history of alcohol abuse, are highly suggestive of gastrointestinal issues. Frequent use of painkillers/analgesics, particularly NSAIDs, is a major risk factor for gastritis, peptic ulcers, and upper gastrointestinal bleeding, which can manifest as blood in stool and throat irritation (due to reflux). Alcohol abuse independently exacerbates these GI issues. The doctor's inquiry about painkiller use correctly identifies a critical factor that, alongside alcohol abuse, provides a strong pathophysiological explanation for the patient's physical symptoms. The psychological symptoms (low self-esteem, depression) are also consistent with chronic pain (headaches) and substance abuse.","NSAID-induced Gastrointestinal Complications (e.g., gastritis, peptic ulcer disease with bleeding), exacerbated by alcohol abuse."
doctor i have been having some health issues lately i have problems during pregnancy low selfesteem throat irritation i abuse alcohol and have been showing hostile behavior what could be causing all of these symptoms,its quite possible that you are suffering from analgesic poisoning overuse of analgesics can cause a variety of symptoms including the ones you have mentioned its important that you seek medical treatment immediately in order to prevent any further damage to your health,0.2970756292343139,False,False,"The provided symptoms - problems during pregnancy, low self-esteem, throat irritation, alcohol abuse, and hostile behavior - do not strongly align with a diagnosis of analgesic poisoning. Analgesic poisoning typically presents with acute physiological symptoms such as nausea, vomiting, abdominal pain, liver damage, kidney dysfunction, or respiratory depression, depending on the type of analgesic. While throat irritation could be a non-specific symptom, and drug use during pregnancy is problematic, the core symptoms of low self-esteem, hostile behavior, and explicit alcohol abuse are characteristic indicators of Alcohol Use Disorder (AUD) and its wide range of psychological, social, and physical complications, including adverse pregnancy outcomes and irritation of the upper GI tract.",Alcohol Use Disorder with associated complications
doctor i have been experiencing an itchy eyelid a vulvar sore fainting shoulder swelling and wrist weakness can you tell me what could be causing these symptoms,based on your symptoms its possible that you have cryptococcosis a fungal infection caused by inhaling the cryptococcus fungus it can affect various parts of the body including the lungs brain and skin leading to symptoms like yours,0.2386721223592758,False,False,"Cryptococcosis typically presents with pulmonary (cough, shortness of breath) or neurological symptoms (headache, fever, neck stiffness, altered mental status), and less commonly skin lesions (papules, nodules, ulcers). The patient's symptoms of an itchy eyelid, vulvar sore, shoulder swelling, and wrist weakness are not characteristic or specific manifestations of cryptococcosis. Vulvar sores, in particular, are highly atypical for this fungal infection, as are localized inflammatory joint symptoms like shoulder swelling and wrist weakness. Fainting and an itchy eyelid are very non-specific symptoms. Therefore, the diagnosis of cryptococcosis is highly unlikely given the provided symptom profile.",Systemic Lupus Erythematosus (SLE)
doctor i have been experiencing leg swelling and fluid retention whats wrong with me,those symptoms indicate that you have pulmonary congestion,0.2583987116813659,False,False,"The patient's symptoms of 'leg swelling and fluid retention' primarily indicate peripheral edema and systemic fluid overload. While these can be associated with conditions that also cause pulmonary congestion (e.g., heart failure), the symptoms provided by the patient do not directly or highly suggest pulmonary congestion without additional respiratory symptoms such as shortness of breath, cough, or orthopnea. Pulmonary congestion specifically refers to fluid accumulation in the lungs, whereas the patient's stated symptoms point to fluid retention in the periphery.",Heart Failure
doctor i have redness in my ear cough mouth ulcers abnormal appearing skin and decreased appetite what could be happening to me,it sounds like you might have herpangina,0.2458561658859253,False,False,"Herpangina typically presents with painful, blister-like ulcers primarily located on the posterior soft palate, tonsils, uvula, and pharynx. While mouth ulcers and decreased appetite are consistent, the presence of 'cough,' 'redness in ear,' and especially 'abnormal appearing skin' are not characteristic features of herpangina. The description of 'abnormal appearing skin' alongside mouth ulcers is highly suggestive of a more widespread viral exanthem. Hand, Foot, and Mouth Disease (HFMD) is a more fitting diagnosis as it commonly presents with oral ulcers and a rash on the skin, often involving the hands, feet, and sometimes other areas, along with other non-specific viral symptoms like cough and decreased appetite.","Hand, Foot, and Mouth Disease"
doctor ive been experiencing weakness fatigue cough and what i think is an allergic reaction what could be causing this,based on your symptoms its possible that you are suffering from conversion disorder,0.1969503611326217,False,False,"Conversion disorder, also known as functional neurological symptom disorder, typically manifests with neurological symptoms (e.g., paralysis, blindness, seizures, speech difficulties, gait issues) that are not consistent with known neurological disease and cannot be explained by another medical condition. The patient's reported symptoms of weakness, fatigue, cough, and a perceived allergic reaction are general constitutional symptoms, a respiratory symptom, and an immunological/inflammatory response, respectively. These do not align with the diagnostic criteria or common presentations of conversion disorder. Instead, they are highly suggestive of an acute general medical illness.",Acute Viral Infection
doctor ive been experiencing sinus congestion neck pain and headaches what could be the problem,it seems like you might have suffered an injury to the trunk which is causing all these symptoms we need to exam you more closely and may need to run some tests to come up with a definite diagnosis,0.2763771712779999,False,False,"The doctor's diagnosis of a 'trunk injury' is highly incongruent with the patient's reported symptoms of 'sinus congestion', 'neck pain', and 'headaches'. Sinus congestion and headaches are classic symptoms of conditions affecting the head and upper respiratory system (e.g., sinusitis, common cold, allergies). Neck pain, while a general symptom, is rarely, if ever, primarily caused by a trunk injury in conjunction with sinus issues. A trunk injury primarily affects the torso (chest, abdomen, back) and typically presents with localized pain, bruising, swelling, or functional limitations in that area, not sinus-related symptoms.",Acute Sinusitis
